URL,Version,Status,OIDs,Name,Title,Description,Used
http://hl7.org/fhir/uv/phr/CodeSystem/apple-health-kit-biological-sex-code-system,1.0.0-ballot,draft,,AppleHealthKitBiologicalSexCodeSystem,Apple HealthKit Biological Sex Code System,"Constants indicating the user’s sex.",
http://hl7.org/fhir/uv/phr/CodeSystem/apple-health-kit-category-type-code-system,1.0.0-ballot,draft,,AppleHealthKitCategoryTypeCodeSystem,Apple HealthKit Category Type Code System,"HKCategoryTypeIdentifier - Identifiers for creating category types.",
http://hl7.org/fhir/uv/phr/CodeSystem/apple-health-kit-characteristic-type-code-system,1.0.0-ballot,draft,,AppleHealthKitCharacteristicTypeCodeSystem,Apple HealthKit Characteristic Type Code System,"The identifiers that create characteristic type objects.",
http://hl7.org/fhir/uv/phr/CodeSystem/apple-health-kit-correlation-type-code-system,1.0.0-ballot,draft,,AppleHealthKitCorrelationTypeCodeSystem,Apple HealthKit Correlation Type Code System,"Code System required for defining correlationType ValueSet",
http://hl7.org/fhir/uv/phr/CodeSystem/apple-health-kit-quantity-type-code-system,1.0.0-ballot,draft,,AppleHealthKitQuantityTypeCodeSystem,Apple HealthKit Quantity Type Code System,"Code System required for defining quantityType ValueSet",
http://hl7.org/fhir/uv/phr/CodeSystem/apple-health-kit-sample-type-code-system,1.0.0-ballot,draft,,AppleHealthKitSampleTypeCodeSystem,Apple HealthKit Sample Type Code System,"Code System required for defining sampleType ValueSet",
http://hl7.org/fhir/uv/phr/CodeSystem/apple-health-kit-workout-activity-type-code-system,1.0.0-ballot,draft,,AppleHEalthKitWorkoutActivityTypeCodeSystem,Apple HealthKit Workout Activity Type Code System,"Code System required for defining workoutActivityType ValueSet",
http://hl7.org/fhir/uv/phr/CodeSystem/apple-health-kit-workout-event-type-code-system,1.0.0-ballot,draft,,AppleHealthKitWorkoutEventTypeCodeSystem,Apple HealthKit Workout Event Type Code System,"Code System required for defining workout event type ValueSet",
